,双百企业名单
0,中核第四研究设计工程有限公司
1,中核控制系统工程有限公司
2,中国核工业华兴建设有限公司
3,中国核工业二三建设有限公司
4,北京神舟航天软件技术有限公司
5,上海航天设备制造总厂有限公司
6,湖南航天有限责任公司
7,航天云网科技发展有限责任公司
8,航天科工空间工程发展有限公司
9,海鹰航空通用装备有限责任公司
10,航天科工火箭技术有限公司
11,中航通用飞机有限责任公司
12,中国航空技术国际控股有限公司
13,中航机载系统有限公司
14,中国船舶（香港）航运租赁有限公司
15,九江精达检测技术有限公司
16,重庆前卫科技集团有限公司
17,中船重工（邯郸）派瑞特种气体有限公司
18,山西汾西重工有限责任公司
19,武汉重型机床集团有限公司
20,内蒙古北方重工业集团有限公司
21,万友汽车投资有限公司
22,四川华川工业有限公司
23,中国电子科技网络信息安全有限公司
24,中电力神有限公司
25,中电科电子装备集团有限公司
26,中国航发商用发动机有限责任公司
27,中国航发湖南南方宇航工业有限公司
28,中国石油集团渤海石油装备制造有限公司
29,昆仑能源有限公司
30,中国石化润滑油有限公司
31,中石化易捷销售有限公司
32,中海油安全技术服务有限公司
33,南瑞集团有限公司
34,国网电动汽车服务有限公司
35,国网江苏综合能源服务有限公司
36,国网电子商务有限公司（国网雄安金融科技集团）
37,平高集团有限公司
38,浙江省送变电工程有限公司
39,国中康健集团有限公司
40,深圳供电局有限公司
41,南方电网综合能源有限公司
42,广东省输变电工程有限公司
43,南方电网科学研究院有限公司
44,广州穗能通综合能源有限责任公司
45,华能资本服务有限公司
46,四川华能能源销售有限公司
47,大唐京津冀能源开发有限公司
48,华电江苏能源有限公司
49,国家电投集团内蒙古能源有限公司
50,中国电力国际有限公司
51,三峡资本控股有限责任公司
52,中国水利电力对外有限公司
53,神华包神铁路集团有限责任公司
54,北京国电龙源环保工程有限公司
55,国电联合动力技术有限公司
56,天翼电子商务有限公司
57,联通智网科技有限公司
58,中国联合网络通信有限公司云南省分公司
59,咪咕文化科技有限公司
60,中国移动通信集团终端有限公司
61,中移在线服务有限公司
62,华大半导体有限公司
63,中国电子系统技术有限公司
64,一汽吉林汽车有限公司
65,一汽模具制造有限公司
66,东风锻造有限公司
67,东风鸿泰控股集团有限公司
68,一重集团大连工程技术有限公司
69,中国第一重型机械集团大连加氢反应器制造有限公司
70,中国联合工程有限公司
71,中国恒天集团有限公司
72,中国中元国际工程有限公司
73,哈尔滨汽轮机厂有限责任公司
74,哈电集团哈尔滨电站阀门有限公司
75,东方电气风电有限公司
76,鞍钢集团矿业有限公司
77,鞍钢集团工程技术有限公司
78,武钢集团有限公司
79,宝武特种冶金有限公司
80,宝钢金属有限公司
81,西南铝业（集团）有限责任公司
82,中铝华中铜业有限公司
83,中远海运集装箱运输有限公司
84,宁波中远海运物流有限公司
85,中国国际货运航空有限公司
86,东方航空物流有限公司
87,中国联合航空有限公司
88,南航货运物流公司
89,南航通用航空有限公司
90,中粮酒业投资有限公司
91,中冶赛迪集团有限公司
92,中国有色工程有限公司
93,中国十七冶集团有限公司
94,中冶南方工程技术有限公司
95,中国纺织科学研究院有限公司
96,沈阳机床（集团）有限责任公司
97,中建水务环保有限公司
98,中建一局集团第二建筑有限公司
99,中国储备棉管理有限公司
100,中央储备粮顺义直属库有限公司
101,中央储备粮榆树直属库有限公司
102,中国国投高新产业投资有限公司
103,国投生物科技投资有限公司
104,招商局重庆交通科研设计院有限公司
105,招商路凯国际控股有限公司
106,华润微电子控股有限公司
107,中国旅游旅行服务有限公司
108,上海航空工业（集团）有限公司
109,上海翔运国际货运有限公司
110,中国新时代控股集团有限公司
111,中国环境保护集团有限公司
112,中节能建筑节能有限公司
113,中咨工程管理咨询有限公司
114,中咨海外咨询有限公司
115,中特物流有限公司
116,中国煤矿机械装备有限责任公司
117,中煤西安设计工程有限责任公司
118,中煤科工集团西安研究院有限公司
119,中煤科工集团重庆设计研究院有限公司
120,中机寰宇认证检验有限公司
121,北自所（北京）科技发展有限公司
122,沈阳铸造研究所有限公司
123,中钢集团马鞍山矿山研究院有限公司
124,中钢集团邢台机械轧辊有限公司
125,中钢洛耐新材料科技有限公司
126,中科钢研节能科技有限公司
127,南通星辰合成材料有限公司
128,中国化学工程重型机械化有限公司
129,中国化学工程第九建设有限公司
130,化学工业岩土工程有限公司
131,合肥水泥研究设计院有限公司
132,大冶有色金属集团控股有限公司
133,中国有色集团沈阳矿业投资有限公司
134,中国有色桂林矿产地质研究院有限公司
135,有研粉末新材料（北京）有限公司
136,北矿检测技术有限公司
137,北京北矿亿博科技有限责任公司
138,北矿新材科技有限公司
139,中智上海经济技术合作公司
140,中智人力资源管理咨询有限公司
141,北京建筑机械化研究院有限公司
142,中车株洲电机有限公司
143,中车齐车集团有限公司
144,中车株洲电力机车研究所有限公司
145,中车株洲电力机车有限公司
146,中车大连机车车辆有限公司
147,北京全路通信信号研究设计院集团有限公司
148,通号智慧城市研究设计院有限公司
149,中铁九局集团有限公司
150,中铁二院工程集团有限责任公司
151,中铁国际集团有限公司
152,中铁二十三局集团有限公司
153,中铁第四勘察设计院集团有限公司
154,中铁第五勘察设计院集团有限公司
155,中交房地产集团有限公司
156,中国交通信息中心有限公司
157,中交水运规划设计院有限公司
158,中交一公局集团有限公司
159,南京南方电讯有限公司
160,电信科学技术第十研究所有限公司
161,电信科学技术第一研究所有限公司
162,辰芯科技有限公司
163,中国牧工商集团有限公司
164,绥芬河国林木业城投资有限公司
165,杭州千岛湖发展集团有限公司
166,中国医药投资有限公司
167,中国医药集团联合工程有限公司
168,保利国际控股有限公司
169,中国工艺集团有限公司
170,中国蚕丝绸缎进出口公司
171,中国丝绸服装进出口有限公司
172,北京国标建筑科技有限责任公司
173,都市高科（北京）环境科技有限公司
174,正元地理信息有限责任公司
175,三川德青科技有限公司
176,江苏中煤长江地质勘查集团有限公司
177,中煤航测遥感集团有限公司
178,南京际华三五二一环保科技有限公司
179,中国航空结算有限责任公司
180,天信达信息技术有限公司
181,中国航油集团石油有限公司
182,重庆市泽胜船务（集团）有限公司
183,中国民航技术装备有限责任公司
184,昆明利顿人通信息服务有限公司
185,中国水利水电第十四工程局有限公司
186,中国电建集团中南勘测设计研究院有限公司
187,中电建建筑集团有限公司
188,中国电建集团贵州工程有限公司
189,中国能源建设集团湖南省电力设计院有限公司
190,中国能源建设集团安徽电力建设第二工程有限公司
191,西藏华泰龙矿业开发有限公司
192,中广核核电运营有限公司
193,中广核研究院有限公司
194,中广核节能产业发展有限公司
195,中国广核新能源控股有限公司
196,北方华录文化科技（北京）有限公司
197,北京华录新媒信息技术有限公司
198,深圳市易平方网络科技有限公司
199,南光国际会议展览有限公司
200,西安西电电力系统有限公司
201,西安西电开关电气有限公司
202,中铁物轨道科技服务集团有限公司
203,武汉中铁伊通物流有限公司
204,中国国新基金管理有限公司
205,国新资本有限公司
206,中国文化产业发展集团有限公司
207,首钢集团有限公司
208,北京能源集团有限责任公司
209,北京外企人力资源服务有限公司
210,天津光电集团有限公司
211,天津津融资产管理有限公司
212,天津液压机械（集团）有限公司
213,天津泰达建设集团有限公司
214,天津物产电子商务有限公司
215,河北省资产管理有限公司
216,唐山钢铁集团有限责任公司
217,华北医疗健康产业有限公司
218,河北建投国融能源服务有限公司
219,河北国控资本管理有限公司
220,山西杏花村汾酒集团有限责任公司
221,山西焦煤集团有限责任公司
222,太原钢铁（集团）有限公司
223,阳泉煤业（集团）有限责任公司
224,格盟国际能源有限公司
225,晋能清洁能源有限公司
226,内蒙古交通投资（集团）有限责任公司
227,内蒙古电力集团综合能源有限责任公司
228,华宸信托有限责任公司
229,内蒙古能源发电投资集团有限公司
230,包头钢铁（集团）有限责任公司
231,辽宁省交通规划设计院有限责任公司
232,凌源钢铁集团有限责任公司
233,华晨汽车集团控股有限公司
234,中国吉林森林工业集团有限责任公司
235,吉林省农牧科技有限公司
236,长春市热力（集团）有限责任公司
237,吉林化纤集团有限责任公司
238,黑龙江中盟龙新化工有限公司
239,上海电气环保集团
240,上海制皂（集团）有限公司
241,上海燃气有限公司
242,江苏省国信资产管理集团有限公司
243,江苏省盐业集团有限责任公司
244,南京金陵饭店集团有限公司
245,南京旅游集团有限责任公司
246,徐工集团工程机械有限公司
247,浙江省浙商资产管理有限公司
248,浙江高速信息工程技术有限公司
249,杭州市水务控股集团有限公司
250,安徽铜冠铜箔有限公司
251,福建省国有资产管理有限公司
252,福人木业（福州）有限公司
253,江西铜业集团有限公司
254,新余钢铁集团有限公司
255,江西省绿色产业集团有限公司
256,江西省天然气（赣投气通）控股有限公司
257,中鼎国际建设集团有限责任公司
258,江铃汽车集团公司
259,山东黄金集团有限公司
260,山东国惠投资有限公司
261,济南二机床集团有限公司
262,中国平煤神马集团开封炭素有限公司
263,三门峡戴卡轮毂制造有限公司
264,河南省中原石油天然气集团有限公司
265,安阳钢铁集团有限责任公司
266,河南投资集团有限公司
267,湖北省铁路建设投资集团有限责任公司
268,湖北空港航空物流有限公司
269,湖北广盐蓝天盐化有限公司
270,湖南建工集团有限公司
271,湖南省交通水利建设集团有限公司
272,湖南湘电动力有限公司
273,湖南新天地保安服务有限公司
274,湖南省建筑设计院有限公司
275,广东省产权交易集团有限公司
276,广东粤海控股集团有限公司
277,广东广业清怡食品科技有限公司
278,广州无线电集团有限公司
279,广东省机场管理集团翼通商务航空服务有限公司
280,广州医药集团有限公司
281,广西建工集团有限责任公司
282,广西柳工集团有限公司
283,广西荣桂物流集团有限公司
284,百色百矿集团有限公司
285,海南省建设集团有限公司
286,重庆渝富资产经营管理集团有限公司
287,重庆商社(集团)有限公司
288,重庆医药健康产业有限公司
289,重庆三峰环境产业集团有限公司
290,重庆对外经贸（集团）有限公司
291,四川省商业投资集团有限责任公司
292,四川航空集团有限责任公司
293,华西牙科有限责任公司
294,四川交投实业有限公司
295,成都产业投资集团有限公司
296,四川九洲卫星导航投资发展有限公司
297,贵州盘江煤电集团有限责任公司
298,贵州中建伟业建设工程有限责任公司
299,贵州金州电力有限责任公司
300,云南省贵金属新材料控股集团有限公司
301,云南锡业集团（控股）有限责任公司
302,云南省能源投资集团有限公司
303,云南省设计院集团
304,云南天朗节能环保集团有限公司
305,陕西钢铁集团有限公司
306,陕西延长中煤榆林能源化工有限公司
307,陕西环保固体废物处置利用有限责任公司
308,陕汽集团商用车有限公司
309,陕西燃气集团新能源发展有限公司
310,西北永新集团有限公司
311,甘肃省公路交通建设集团有限公司
312,兰州中川国际机场有限公司
313,甘肃省国有资产投资集团有限公司
314,甘肃工程咨询集团有限公司
315,西宁国家低碳产业基金投资管理有限公司
316,宁夏水务投资集团有限公司
317,宁夏建设投资集团有限公司
318,银川通联资本投资运营有限公司
319,新疆生产建设兵团石油有限公司
320,新疆通用航空有限责任公司
321,新疆生产建设兵团建设工程（集团）有限责任公司
322,大连市建设投资集团有限公司
323,瓦房店轴承集团有限责任公司
324,三寰集团有限公司
325,宁波国际投资咨询有限公司
326,宁波市交通建设工程试验检测中心有限公司
327,厦门国贸控股集团有限公司
328,厦门象屿集团有限公司
329,夏商农产品集团
330,双星集团有限责任公司
331,青岛宏达塑胶总公司
332,深圳市投资控股有限公司
333,深圳市粮食集团有限公司
334,深圳国际控股有限公司
335,深圳市特发集团有限公司
336,深圳市远致投资有限公司
